{
  "$schema": "../schemas/layout.schema.json",
  "schemaVersion": 2,
  "definitionVersion": "2.0.0-draft.5",
  "id": "ifosoft.account-plan-uctrozvrh",
  "kind": "layout",
  "status": "reviewDraft",
  "productionApproved": false,
  "requiresCapabilities": [
    "positioned.v2"
  ],
  "sourceRefs": [
    {
      "file": "sources/IfoSoft-v2-review.zip",
      "sha256": "3d74f8a56bfd23fe52557f82018268612f62005cfdb1063064f211fbbb9788c0"
    }
  ],
  "reviewNotes": [],
  "formats": [
    "PDF",
    "XPS",
    "OXPS"
  ],
  "modelRef": {
    "id": "ifosoft.model.account-plan-uctrozvrh",
    "version": "2.0.0-draft.5"
  },
  "identificationRefs": [
    {
      "id": "ifosoft.identify.uctrozvrh",
      "version": "2.0.0-draft.5"
    }
  ],
  "parserRefs": [
    {
      "id": "ifosoft.parsers",
      "version": "2.0.0-draft.5"
    }
  ],
  "validationRefs": [
    {
      "id": "ifosoft.account-plan-uctrozvrh.validation",
      "version": "2.0.0-draft.5"
    }
  ],
  "variants": [
    {
      "id": "urozvrh",
      "evidenceStatus": "sourceDerived",
      "sourceRefs": [
        {
          "file": "_UROZVRH.gmx",
          "sha256": "e01464ce3e95158fe8226fd9a135a5ec09e4aa7a069e4d8e359c6b5cae0e6392"
        }
      ],
      "nominalPageSizePt": [
        595.275591,
        841.889764
      ],
      "anchors": [
        {
          "id": "line-9-0",
          "feature": "rulingEndpoint",
          "pointPt": [
            19.84252,
            802.204724
          ],
          "blockRef": "pagehead",
          "lineRef": "line-9",
          "endpointIndex": 0,
          "evidenceStatus": "sourceDerived",
          "sourceRefs": [
            {
              "file": "_UROZVRH.gmx",
              "line": 9,
              "rawCommand": "|CPLINE(70,140,2030,140,4,0,0,0)"
            }
          ]
        },
        {
          "id": "line-9-1",
          "feature": "rulingEndpoint",
          "pointPt": [
            575.433071,
            802.204724
          ],
          "blockRef": "pagehead",
          "lineRef": "line-9",
          "endpointIndex": 1,
          "evidenceStatus": "sourceDerived",
          "sourceRefs": [
            {
              "file": "_UROZVRH.gmx",
              "line": 9,
              "rawCommand": "|CPLINE(70,140,2030,140,4,0,0,0)"
            }
          ]
        },
        {
          "id": "line-12-0",
          "feature": "rulingEndpoint",
          "pointPt": [
            19.84252,
            782.362205
          ],
          "blockRef": "pagehead",
          "lineRef": "line-12",
          "endpointIndex": 0,
          "evidenceStatus": "sourceDerived",
          "sourceRefs": [
            {
              "file": "_UROZVRH.gmx",
              "line": 12,
              "rawCommand": "|CPLINE(70,210,2030,210,4,0,0,0)"
            }
          ]
        },
        {
          "id": "line-12-1",
          "feature": "rulingEndpoint",
          "pointPt": [
            575.433071,
            782.362205
          ],
          "blockRef": "pagehead",
          "lineRef": "line-12",
          "endpointIndex": 1,
          "evidenceStatus": "sourceDerived",
          "sourceRefs": [
            {
              "file": "_UROZVRH.gmx",
              "line": 12,
              "rawCommand": "|CPLINE(70,210,2030,210,4,0,0,0)"
            }
          ]
        }
      ],
      "blocks": [
        {
          "id": "pagehead",
          "kind": "pageHeader",
          "frame": "nominalPage",
          "sourceRefs": [
            {
              "file": "_UROZVRH.gmx",
              "rawCommand": "#PAGEHEAD(57,0)"
            }
          ],
          "nominalAdvancePt": 16.15748,
          "emptyTemplate": false,
          "placement": {
            "id": "locate-pagehead",
            "op": "locateBlock",
            "enabled": true,
            "evidenceStatus": "sourceDerived",
            "sourceRefs": [],
            "reviewNotes": [],
            "frame": "nominalPage",
            "origin": "pageCalibration",
            "signals": [
              "rulings",
              "labels",
              "fieldColumns",
              "unassignedText"
            ],
            "combination": "union",
            "onAmbiguous": "retainHypotheses"
          },
          "candidateDetection": {
            "id": "detect-pagehead",
            "op": "detectCandidates",
            "enabled": true,
            "evidenceStatus": "sourceDerived",
            "sourceRefs": [],
            "reviewNotes": [],
            "signals": [
              "rulings",
              "labels",
              "fieldColumns",
              "unassignedText"
            ],
            "combination": "union",
            "requiresSuccessfulParsing": false
          },
          "fieldAssignment": {
            "id": "assign-pagehead",
            "op": "assignFields",
            "enabled": true,
            "evidenceStatus": "sourceDerived",
            "sourceRefs": [],
            "reviewNotes": [],
            "paddingPt": 1.5,
            "assembly": "glyphClusters",
            "splitAcrossFields": "requireGlyphGeometry",
            "overlap": "retainAmbiguity",
            "retainClippedSource": true
          },
          "fields": [
            {
              "id": "field-5",
              "semanticName": "licensedUserText",
              "rectPt": [
                382.677165,
                828.283465,
                574.015748,
                839.055118
              ],
              "parserRef": "text",
              "sourceRefs": [
                {
                  "file": "_UROZVRH.gmx",
                  "line": 5,
                  "rawCommand": "|CPDATABASE(1350,10,2025,48,1,0,0,1,16777215,1,0,2,5,8,0,0,0,400,0,0,0,238,3,2,1,18,\"Tahoma\",0,1,2,0,\"'$USER'\",1,0,0,0,0,0)",
                  "expression": "$USER"
                }
              ]
            },
            {
              "id": "field-7",
              "semanticName": "printedPageNumber",
              "rectPt": [
                558.425197,
                805.606299,
                576.0,
                816.377953
              ],
              "parserRef": "integer",
              "sourceRefs": [
                {
                  "file": "_UROZVRH.gmx",
                  "line": 7,
                  "rawCommand": "|CPDATABASE(1970,90,2032,128,1,0,0,1,16777215,1,0,2,5,8,0,0,0,400,0,0,0,238,3,2,1,18,\"Tahoma\",0,1,2,0,\"'$PAGENO'\",1,0,0,0,0,0)",
                  "expression": "$PAGENO"
                }
              ]
            }
          ],
          "labels": [
            {
              "id": "label-6",
              "text": "Strana:",
              "rectPt": [
                532.913386,
                805.606299,
                558.708661,
                816.377953
              ],
              "sourceRefs": [
                {
                  "file": "_UROZVRH.gmx",
                  "line": 6,
                  "rawCommand": "|CPLABEL(1880,90,1971,128,1,0,0,1,16777215,1,0,2,5,8,0,0,0,400,0,0,0,238,3,2,1,18,\"Tahoma\",0,0,2,\"Strana:\")"
                }
              ]
            },
            {
              "id": "label-8",
              "text": "ÚČTOVÝ  ROZVRH  ANALYTICKÝCH  ÚČTOV",
              "rectPt": [
                167.244094,
                805.889764,
                426.614173,
                822.047244
              ],
              "sourceRefs": [
                {
                  "file": "_UROZVRH.gmx",
                  "line": 8,
                  "rawCommand": "|CPLABEL(590,70,1505,127,0,0,0,1,0,1,16777215,2,5,12,0,0,0,700,0,0,0,238,3,2,1,34,\"Tahoma\",0,0,2,\"ÚČTOVÝ  ROZVRH  ANALYTICKÝCH  ÚČTOV\")"
                }
              ]
            },
            {
              "id": "label-10",
              "text": "SYN",
              "rectPt": [
                48.188976,
                785.76378,
                62.645669,
                796.535433
              ],
              "sourceRefs": [
                {
                  "file": "_UROZVRH.gmx",
                  "line": 10,
                  "rawCommand": "|CPLABEL(170,160,221,198,1,0,0,1,16777215,1,0,2,5,8,0,0,0,400,0,0,0,238,3,2,1,18,\"Tahoma\",0,0,2,\"SYN\")"
                }
              ]
            },
            {
              "id": "label-11",
              "text": "Názov účtu",
              "rectPt": [
                96.377953,
                785.76378,
                135.779528,
                796.535433
              ],
              "sourceRefs": [
                {
                  "file": "_UROZVRH.gmx",
                  "line": 11,
                  "rawCommand": "|CPLABEL(340,160,479,198,1,0,0,1,16777215,1,0,2,5,8,0,0,0,400,0,0,0,238,3,2,1,18,\"Tahoma\",0,0,2,\"Názov účtu\")"
                }
              ]
            },
            {
              "id": "label-13",
              "text": "ANA",
              "rectPt": [
                70.866142,
                785.76378,
                86.173228,
                796.535433
              ],
              "sourceRefs": [
                {
                  "file": "_UROZVRH.gmx",
                  "line": 13,
                  "rawCommand": "|CPLABEL(250,160,304,198,1,0,0,1,16777215,1,0,2,5,8,0,0,0,400,0,0,0,238,3,2,1,18,\"Tahoma\",0,0,2,\"ANA\")"
                }
              ]
            },
            {
              "id": "label-14",
              "text": "TYP",
              "rectPt": [
                430.866142,
                785.76378,
                444.472441,
                796.535433
              ],
              "sourceRefs": [
                {
                  "file": "_UROZVRH.gmx",
                  "line": 14,
                  "rawCommand": "|CPLABEL(1520,160,1568,198,0,0,0,1,0,1,16777215,2,5,8,0,0,0,400,0,0,0,238,3,2,1,34,\"Tahoma\",0,0,2,\"TYP\")"
                }
              ]
            },
            {
              "id": "label-15",
              "text": "POD",
              "rectPt": [